{
 "types": {
  "template": {
   "name": "Drafting family / template",
   "color": "#2a78d6"
  },
  "succession": {
   "name": "Predecessor, successor, amendment",
   "color": "#eb6834"
  },
  "fedstate": {
   "name": "Federal–state: preemption, reciprocity, threshold lineage",
   "color": "#1baf7a"
  },
  "executive": {
   "name": "Executive order or directive drives action",
   "color": "#eda100"
  },
  "litigation": {
   "name": "Litigation and enforcement",
   "color": "#e87ba4"
  },
  "assurance": {
   "name": "Auditor and verifier layer",
   "color": "#008300"
  },
  "actor": {
   "name": "Sponsor, supporter, opponent, party",
   "color": "#4a3aa7"
  }
 },
 "columns": [
  "Actors",
  "Federal executive",
  "Federal bills and drafts",
  "Enacted state laws",
  "State bills and precursors",
  "Verification infrastructure",
  "Litigation, enforcement, excluded"
 ],
 "nodes": {
  "SB53": {
   "name": "CA SB 53 (TFAIA)",
   "column": 3,
   "kind": "entry",
   "entry_key": "ca-sb-53-tfaia"
  },
  "RAISE": {
   "name": "NY RAISE Act (Ch. 699 → Ch. 96)",
   "column": 3,
   "kind": "entry",
   "entry_key": "ny-raise-act-ch-699-ch-96"
  },
  "SB315": {
   "name": "IL SB 315 (P.A. 104-0538)",
   "column": 3,
   "kind": "entry",
   "entry_key": "il-sb-315-p-a-104-0538"
  },
  "MA": {
   "name": "MA H.5576 / S.3178",
   "column": 4,
   "kind": "entry",
   "entry_key": "ma-h-5576-s-3178"
  },
  "MI4668": {
   "name": "MI HB 4668",
   "column": 4,
   "kind": "entry",
   "entry_key": "mi-hb-4668"
  },
  "NJ": {
   "name": "NJ S.4446 / A.5275",
   "column": 4,
   "kind": "entry",
   "entry_key": "nj-s-4446-a-5275"
  },
  "HB3506": {
   "name": "IL HB 3506 (2025)",
   "column": 4,
   "kind": "entry",
   "entry_key": "il-hb-3506-2025"
  },
  "SB3444": {
   "name": "IL SB 3444",
   "column": 4,
   "kind": "entry",
   "entry_key": "il-sb-3444"
  },
  "SB3312": {
   "name": "IL SB 3312",
   "column": 4,
   "kind": "entry",
   "entry_key": "il-sb-3312"
  },
  "HB4705": {
   "name": "IL HB 4705 / SB 3261",
   "column": 4,
   "kind": "entry",
   "entry_key": "il-hb-4705-sb-3261"
  },
  "TN": {
   "name": "TN HB 1898 / SB 2171",
   "column": 4,
   "kind": "entry",
   "entry_key": "tn-hb-1898-sb-2171"
  },
  "UT": {
   "name": "UT HB 286",
   "column": 4,
   "kind": "entry",
   "entry_key": "ut-hb-286"
  },
  "LA": {
   "name": "LA SB 474",
   "column": 4,
   "kind": "entry",
   "entry_key": "la-sb-474"
  },
  "RI": {
   "name": "RI S.358 / H.5224",
   "column": 4,
   "kind": "entry",
   "entry_key": "ri-s-358-h-5224"
  },
  "S10373": {
   "name": "NY S.10373 (verification)",
   "column": 4,
   "kind": "entry",
   "entry_key": "ny-s-10373-verification"
  },
  "S10456": {
   "name": "NY S.10456 (minimum standards)",
   "column": 4,
   "kind": "entry",
   "entry_key": "ny-s-10456-minimum-standards"
  },
  "MN4532": {
   "name": "MN HF 4532 (no threshold)",
   "column": 4,
   "kind": "entry",
   "entry_key": "mn-hf-4532-no-threshold"
  },
  "AB1405": {
   "name": "CA AB 1405 (auditor registry)",
   "column": 5,
   "kind": "entry",
   "entry_key": "ca-ab-1405-auditor-registry"
  },
  "SB813": {
   "name": "CA SB 813 (IVOs)",
   "column": 5,
   "kind": "entry",
   "entry_key": "ca-sb-813-ivos"
  },
  "OH628": {
   "name": "OH HB 628",
   "column": 5,
   "kind": "entry",
   "entry_key": "oh-hb-628"
  },
  "MN4544": {
   "name": "MN HF 4544 / SF 4636",
   "column": 5,
   "kind": "entry",
   "entry_key": "mn-hf-4544-sf-4636"
  },
  "VA797": {
   "name": "VA Ch. 425 / 426 (JCOTS study)",
   "column": 5,
   "kind": "entry",
   "entry_key": "va-ch-425-426-jcots-study"
  },
  "CTIVO": {
   "name": "CT P.A. 26-15 IVO pilot",
   "column": 5,
   "kind": "entry",
   "entry_key": "ct-p-a-26-15-ivo-pilot"
  },
  "S2938": {
   "name": "S. 2938 AI Risk Evaluation Act",
   "column": 2,
   "kind": "entry",
   "entry_key": "s-2938-ai-risk-evaluation-act"
  },
  "FRONTIER": {
   "name": "H.R. 9925 FRONTIER Act",
   "column": 2,
   "kind": "entry",
   "entry_key": "h-r-9925-frontier-act"
  },
  "S5061": {
   "name": "S. 5061 Secure AI Development Act",
   "column": 2,
   "kind": "entry",
   "entry_key": "s-5061-secure-ai-development-act"
  },
  "CATSR": {
   "name": "H.R. 9914 / S. 5105 CATSR",
   "column": 2,
   "kind": "entry",
   "entry_key": "h-r-9914-s-5105-catsr"
  },
  "HR9477": {
   "name": "H.R. 9477 AI Incident Reporting Act",
   "column": 2,
   "kind": "entry",
   "entry_key": "h-r-9477-ai-incident-reporting-act"
  },
  "HR9917": {
   "name": "H.R. 9917 AI Kill Switch Act",
   "column": 2,
   "kind": "entry",
   "entry_key": "h-r-9917-ai-kill-switch-act"
  },
  "HR9965": {
   "name": "H.R. 9965 ATOMIC Act",
   "column": 2,
   "kind": "entry",
   "entry_key": "h-r-9965-atomic-act"
  },
  "GAAIA": {
   "name": "GAAIA discussion draft",
   "column": 2,
   "kind": "entry",
   "entry_key": "gaaia-discussion-draft"
  },
  "TRUMPAI": {
   "name": "TRUMP AMERICA AI Act draft",
   "column": 2,
   "kind": "entry",
   "entry_key": "trump-america-ai-act-draft"
  },
  "WHFW": {
   "name": "White House legislative recommendations",
   "column": 2,
   "kind": "entry",
   "entry_key": "white-house-legislative-recommendations"
  },
  "BANASI": {
   "name": "S. 5493 / H.R. 10538 Ban Artificial Superintelligence Act",
   "column": 2,
   "kind": "entry",
   "entry_key": "s-5493-h-r-10538-ban-artificial-superintelligence-act"
  },
  "HR9363": {
   "name": "H.R. 9363 AI Security and Innovation Act",
   "column": 2,
   "kind": "entry",
   "entry_key": "h-r-9363-ai-security-and-innovation-act"
  },
  "S1792": {
   "name": "S. 1792 / H.R. 3460 AI Whistleblower Protection Act",
   "column": 2,
   "kind": "entry",
   "entry_key": "s-1792-h-r-3460-ai-whistleblower-protection-act"
  },
  "S4656": {
   "name": "S. 4656 Military AI Act",
   "column": 2,
   "kind": "entry",
   "entry_key": "s-4656-military-ai-act"
  },
  "HR10180": {
   "name": "H.R. 10180 Self-Improving AI Monitoring Act",
   "column": 2,
   "kind": "entry",
   "entry_key": "h-r-10180-self-improving-ai-monitoring-act"
  },
  "HR10189": {
   "name": "H.R. 10189 Defense AI Reliability Act",
   "column": 2,
   "kind": "entry",
   "entry_key": "h-r-10189-defense-ai-reliability-act"
  },
  "EO14365": {
   "name": "EO 14365 (state-law framework)",
   "column": 1,
   "kind": "entry",
   "entry_key": "eo-14365-state-law-framework"
  },
  "FEB27": {
   "name": "Feb. 27, 2026 directive and supply-chain order",
   "column": 1,
   "kind": "entry",
   "entry_key": "feb-27-2026-directive-and-supply-chain-order"
  },
  "EO14409": {
   "name": "EO 14409 (pre-release access)",
   "column": 1,
   "kind": "entry",
   "entry_key": "eo-14409-pre-release-access"
  },
  "JUNE12": {
   "name": "June 12, 2026 export-control directive",
   "column": 1,
   "kind": "entry",
   "entry_key": "june-12-2026-export-control-directive"
  },
  "CAISI": {
   "name": "CAISI and NIST AITE",
   "column": 1,
   "kind": "entry",
   "entry_key": "caisi-and-nist-aite"
  },
  "REMARKS": {
   "name": "Trump remarks, Aug 7, 2026",
   "column": 1,
   "kind": "entry",
   "entry_key": "ca-trump-remarks-aug-7-2026"
  },
  "NOCHALLENGE": {
   "name": "No challenge located to SB 53, RAISE, SB 315",
   "column": 6,
   "kind": "entry",
   "entry_key": "no-challenge-located-to-sb-53-raise-sb-315"
  },
  "DOJTF": {
   "name": "DOJ AI Litigation Task Force",
   "column": 6,
   "kind": "entry",
   "entry_key": "doj-ai-litigation-task-force"
  },
  "COMMERCE": {
   "name": "Commerce 'onerous state AI laws' evaluation",
   "column": 6,
   "kind": "entry",
   "entry_key": "commerce-onerous-state-ai-laws-evaluation"
  },
  "XAI": {
   "name": "X.AI v. Weiser (D. Colo.)",
   "column": 6,
   "kind": "entry",
   "entry_key": "x-ai-v-weiser-d-colo"
  },
  "ANTHvDOW": {
   "name": "Anthropic v. Department of War (N.D. Cal.)",
   "column": 6,
   "kind": "entry",
   "entry_key": "fl-anthropic-v-department-of-war-n-d-cal"
  },
  "DCCIR": {
   "name": "Anthropic v. DoW, D.C. Cir. (§ 4713) — petition denied",
   "column": 6,
   "kind": "entry",
   "entry_key": "ca-anthropic-v-dow-d-c-cir-4713-petition-denied"
  },
  "PROTECTDEM": {
   "name": "Protect Democracy v. ONCD",
   "column": 6,
   "kind": "entry",
   "entry_key": "protect-democracy-v-oncd"
  },
  "CADOJ": {
   "name": "California DOJ enforcement capacity",
   "column": 6,
   "kind": "entry",
   "entry_key": "california-doj-enforcement-capacity"
  },
  "LINEAGE": {
   "name": "10²⁶ threshold lineage (EO 14110)",
   "column": 1,
   "kind": "entry",
   "entry_key": "1026-threshold-lineage-eo-14110"
  },
  "SB1047": {
   "name": "CA SB 1047 (vetoed 2024)",
   "column": 4,
   "kind": "entry",
   "entry_key": "ca-sb-1047-vetoed-2024"
  },
  "MORATORIUM": {
   "name": "2025 reconciliation moratorium (struck 99–1)",
   "column": 2,
   "kind": "entry",
   "entry_key": "2025-reconciliation-moratorium-struck-99-1"
  },
  "BALLOT": {
   "name": "CA ballot initiative 25-0034 (withdrawn)",
   "column": 4,
   "kind": "entry",
   "entry_key": "ca-ballot-initiative-25-0034-withdrawn"
  },
  "CTSB5": {
   "name": "CT P.A. 26-15 (omnibus)",
   "column": 3,
   "kind": "entry",
   "entry_key": "ct-p-a-26-15-omnibus"
  },
  "COLORADO": {
   "name": "Colorado SB 24-205 → SB 26-189",
   "column": 6,
   "kind": "entry",
   "entry_key": "colorado-sb-24-205-sb-26-189"
  },
  "VA2094": {
   "name": "VA HB 2094 (2025, vetoed)",
   "column": 6,
   "kind": "entry",
   "entry_key": "va-hb-2094-2025-vetoed"
  },
  "AIRMSA": {
   "name": "S. 5576 Warner–Schatz–Kim AI Risk Management and Security Act",
   "column": 2,
   "kind": "entry",
   "entry_key": "s-5576-warner-schatz-kim-ai-risk-management-and-security-act"
  },
  "AIEBA": {
   "name": "S. 5417 / H.R. 10567 AI Emergency Button Act",
   "column": 2,
   "kind": "entry",
   "entry_key": "s-5417-h-r-10567-ai-emergency-button-act"
  },
  "AIREG": {
   "name": "AI Regulator Act (Bennet–Welch proposal)",
   "column": 2,
   "kind": "entry",
   "entry_key": "ai-regulator-act-bennet-welch-proposal"
  },